{
  "id": "vc_post_cutoff_example_001",
  "case_class": "post_cutoff",
  "fake_date_variant": null,
  "raw_world_change": "Real detailed event text with company names, ticker symbols, specific dates, and specific amounts.",
  "masked_world_change_override": "",
  "sector_or_theme": "example_theme",
  "structural_features": [
    "feature_one",
    "feature_two",
    "feature_three"
  ],
  "primary_source_class": "sec_8k_plus_company_release",
  "entities": {
    "companies": ["Example Corp"],
    "tickers": ["EXMP"],
    "people": ["Jane Doe"],
    "deals": ["Example Deal"]
  },
  "model_decision_json": {
    "decision": "no_trade",
    "direction": "none",
    "confidence_bucket": "medium",
    "rationale_hash": "sha256:replace_me"
  },
  "resolved_outcome_json": {
    "outcome": "thesis_refuted",
    "horizon_days": 7,
    "external_mechanism_check": "Primary-source resolution summary for human/audit use."
  },
  "passed": 0,
  "created_at": "2026-05-30T00:00:00Z",
  "experiment_id": "validation_corpus_v1"
}
